{
  "$schema": "https://json-schema.org/draft/2020-12/schema",
  "$id": "https://kora.local/kora-stream-games/preset.schema.json",
  "title": "Preset",
  "description": "A configuração de uma live: modalidade, mapa, look e os 6 slots de presente. Ver R1, R2 e ADR-007. A unicidade de presenteId entre slots (R1.4) não é expressável em JSON Schema e é checada em scripts/validar-contratos.mjs.",
  "type": "object",
  "additionalProperties": false,
  "required": ["presetId", "streamerId", "nome", "modalidade", "slots"],
  "properties": {
    "presetId": { "$ref": "comuns.schema.json#/$defs/identificador" },
    "streamerId": { "$ref": "comuns.schema.json#/$defs/streamerId" },
    "nome": { "type": "string", "minLength": 1, "maxLength": 80 },
    "modalidade": { "$ref": "comuns.schema.json#/$defs/modalidade" },
    "mapaId": {
      "description": "Mapa usado por este preset. Nulo enquanto o streamer não gerou nenhum.",
      "oneOf": [
        { "$ref": "comuns.schema.json#/$defs/identificador" },
        { "type": "null" }
      ]
    },
    "atualizadoEm": { "$ref": "comuns.schema.json#/$defs/instante" },
    "personagem": {
      "description": "Referência a um look montado no vestiário dentro do jogo. A composição vive em data/looks/. Ver ADR-011.",
      "type": "object",
      "additionalProperties": false,
      "required": ["lookId"],
      "properties": {
        "lookId": {
          "oneOf": [
            { "$ref": "comuns.schema.json#/$defs/identificador" },
            { "type": "null" }
          ]
        }
      }
    },
    "cutsceneDeVitoria": {
      "description": "A cutscene que o overlay do OBS toca quando a rodada termina em vitória: o nome de um vídeo de data/cutscenes/, sem extensão (ADR-014). A pasta é a lista — não há cadastro. Ausente ou nula = nada toca, e o placar só muda.",
      "oneOf": [{ "$ref": "comuns.schema.json#/$defs/identificador" }, { "type": "null" }]
    },
    "cutsceneDeDerrota": {
      "description": "A cutscene da derrota — portal quebrado ou donate de derrota. Mesma regra da vitória.",
      "oneOf": [{ "$ref": "comuns.schema.json#/$defs/identificador" }, { "type": "null" }]
    },
    "portal": {
      "description": "O portal do primeiro andar. Volta ao pé da torre depois de ter saído e ele se ergue: a partir dali a derrota deixa de ser automática e passa a ser DISPUTADA — só presente negativo o quebra, e enquanto ele estiver de pé dá para escapar subindo. Ausente = 2000 de vida, o padrão.",
      "type": "object",
      "additionalProperties": false,
      "properties": {
        "vida": {
          "description": "Quanto ANDAR de empurrão para baixo o portal aguenta antes de quebrar. A unidade é a mesma do delta: um presente de -20 tira 20. Com a torre de 1000, 2000 é o equivalente a duas torres inteiras de queda.",
          "type": "integer",
          "minimum": 1,
          "maximum": 100000
        }
      }
    },
    "movimento": {
      "description": "A tabela de movimento: quanto a torre anda com CADA presente do catálogo, e não só com os 6 dos slots (ADR-016). O delta sai de uma regra — moedas × multiplicador —, e cada presente pode ter o seu ajustado à mão em `excecoes`. Ausente = comportamento do ADR-007 puro: presente fora dos 6 slots não faz nada. Os slots continuam mandando no presente que está neles: o delta do slot vence a tabela, e é lá que se escolhe a animação daquele presente.",
      "type": "object",
      "additionalProperties": false,
      "required": ["ativo", "multiplicador", "animacaoDeSubida", "animacaoDeDescida", "intensidade"],
      "properties": {
        "ativo": {
          "description": "Falso desliga a tabela inteira e devolve o jogo aos 6 slots. As exceções ficam guardadas, para religar sem reconfigurar.",
          "type": "boolean"
        },
        "multiplicador": {
          "description": "Andares por moeda. 10 é o padrão pedido pelo dono: rosa de 1 moeda sobe 10. Zero desliga a regra e deixa valer só o que estiver em `excecoes` — o modo \"só o que eu escolhi a mão\".",
          "type": "integer",
          "minimum": 0,
          "maximum": 1000
        },
        "animacaoDeSubida": {
          "description": "A animação de todo presente que sobe pela tabela. Uma só, e curta: aqui entra o catálogo inteiro, não os 6 escolhidos, e cada animação ocupa o canal pelo tempo dela.",
          "$ref": "comuns.schema.json#/$defs/animacaoId"
        },
        "animacaoDeDescida": {
          "description": "A mesma coisa para quem desce.",
          "$ref": "comuns.schema.json#/$defs/animacaoId"
        },
        "intensidade": { "$ref": "comuns.schema.json#/$defs/intensidade" },
        "excecoes": {
          "description": "O que foge da regra, presente a presente. Só o que o streamer mexeu mora aqui: o resto sai da conta, e presente novo no catálogo da TikTok já nasce com delta sem ninguém configurar nada.",
          "type": "array",
          "maxItems": 2000,
          "items": { "$ref": "#/$defs/excecaoDeMovimento" }
        }
      }
    },
    "placar": {
      "description": "Presentes que mexem no PLACAR em vez de animar. Lista separada dos 6 slots de propósito (ADR-007): presente de vitória não pode custar um slot de subida, e as duas coisas crescem sem competir. Um presente não pode estar aqui E nos slots — ver a regra cruzada em bridge/src/dominio/regras.mjs.",
      "type": "array",
      "maxItems": 6,
      "items": { "$ref": "#/$defs/vinculoDePlacar" }
    },
    "slots": {
      "description": "No máximo 6. Slot vazio simplesmente não aparece: preset com menos de 6 preenchidos é válido (R1.3).",
      "type": "array",
      "maxItems": 6,
      "items": { "$ref": "#/$defs/slot" },
      "allOf": [
        { "contains": { "$ref": "#/$defs/naPosicao1" }, "minContains": 0, "maxContains": 1 },
        { "contains": { "$ref": "#/$defs/naPosicao2" }, "minContains": 0, "maxContains": 1 },
        { "contains": { "$ref": "#/$defs/naPosicao3" }, "minContains": 0, "maxContains": 1 },
        { "contains": { "$ref": "#/$defs/naPosicao4" }, "minContains": 0, "maxContains": 1 },
        { "contains": { "$ref": "#/$defs/naPosicao5" }, "minContains": 0, "maxContains": 1 },
        { "contains": { "$ref": "#/$defs/naPosicao6" }, "minContains": 0, "maxContains": 1 }
      ]
    }
  },
  "$defs": {
    "excecaoDeMovimento": {
      "description": "Um presente cujo delta o streamer escreveu à mão, em vez de deixar a regra calcular.",
      "type": "object",
      "additionalProperties": false,
      "required": ["presenteId", "delta"],
      "properties": {
        "presenteId": { "$ref": "comuns.schema.json#/$defs/presenteId" },
        "delta": {
          "description": "Inteiro de plataformas, como em R2 — positivo sobe, negativo desce. A diferença é o ZERO, que aqui vale e quer dizer \"este presente não mexe na torre\". É como se apaga um presente da tabela sem desligar a tabela inteira; ele volta a contar como não mapeado.",
          "type": "integer"
        }
      }
    },
    "vinculoDePlacar": {
      "type": "object",
      "additionalProperties": false,
      "required": ["presenteId", "efeito"],
      "properties": {
        "presenteId": { "$ref": "comuns.schema.json#/$defs/presenteId" },
        "efeito": {
          "description": "O que o presente faz ao placar. Encerra a rodada inteira: conta ponto, joga o streamer de volta ao pé da torre (ou ao topo) e dispara a contagem. \"derrota\" QUEBRA o portal na hora, sem precisar gastar a vida dele — é o atalho que o donate compra. Rajada vale N rodadas, cobradas uma a uma.",
          "type": "string",
          "enum": ["vitoria", "derrota"]
        }
      }
    },
    "slot": {
      "description": "Um presente ligado a uma animação, com delta e intensidade. O vínculo é escolha explícita do streamer: o valor em moedas nunca decide nada (R3, ADR-007).",
      "type": "object",
      "additionalProperties": false,
      "required": ["posicao", "presenteId", "animacaoId", "delta", "intensidade"],
      "properties": {
        "posicao": { "type": "integer", "minimum": 1, "maximum": 6 },
        "presenteId": { "$ref": "comuns.schema.json#/$defs/presenteId" },
        "animacaoId": { "$ref": "comuns.schema.json#/$defs/animacaoId" },
        "delta": { "$ref": "comuns.schema.json#/$defs/delta" },
        "intensidade": { "$ref": "comuns.schema.json#/$defs/intensidade" },
        "cooldownMs": { "type": "integer", "minimum": 0, "maximum": 60000, "default": 0 }
      }
    },
    "naPosicao1": { "type": "object", "required": ["posicao"], "properties": { "posicao": { "const": 1 } } },
    "naPosicao2": { "type": "object", "required": ["posicao"], "properties": { "posicao": { "const": 2 } } },
    "naPosicao3": { "type": "object", "required": ["posicao"], "properties": { "posicao": { "const": 3 } } },
    "naPosicao4": { "type": "object", "required": ["posicao"], "properties": { "posicao": { "const": 4 } } },
    "naPosicao5": { "type": "object", "required": ["posicao"], "properties": { "posicao": { "const": 5 } } },
    "naPosicao6": { "type": "object", "required": ["posicao"], "properties": { "posicao": { "const": 6 } } }
  }
}
